{
  "assessment": {
    "probability": {
      "estimate": "very-high",
      "numeric_annual": null,
      "window": "ongoing"
    },
    "severity": "civilizational",
    "summary": "An ongoing, human-caused warming of the climate system with civilizational-scale risks under continued high emissions; 2026 is tracking among the warmest years on record while atmospheric CO2 continues to rise.",
    "timeframe": "Already underway; impacts intensify with cumulative emissions."
  },
  "category": "climate",
  "claims": [
    {
      "id": "claim-1",
      "retrieved_date": "2026-06-29",
      "source_name": "IPCC",
      "source_url": "https://www.ipcc.ch/report/ar6/wg1/chapter/summary-for-policymakers/",
      "text": "The IPCC's Sixth Assessment Report attributes approximately 1.1 °C of global warming since 1850-1900 to human activities.",
      "verification_status": "verified"
    },
    {
      "id": "claim-2",
      "retrieved_date": "2026-09-07",
      "source_name": "NOAA",
      "source_url": "https://www.ncei.noaa.gov/news/global-climate-202513",
      "text": "NOAA's National Centers for Environmental Information ranked 2025 as the third-warmest year in the global temperature record dating back to 1850: the annual global surface temperature was 2.11°F (1.17°C) above the 20th-century average and 2.41°F (1.34°C) above the 1850-1900 pre-industrial average, behind only 2024 and 2023. The ten warmest years in the 176-year record have all occurred since 2015, and upper-ocean heat content was record high in 2025.",
      "verification_status": "verified"
    },
    {
      "id": "claim-3",
      "retrieved_date": "2026-09-07",
      "source_name": "NOAA",
      "source_url": "https://gml.noaa.gov/ccgg/trends/",
      "text": "NOAA's Global Monitoring Laboratory measured a monthly mean atmospheric CO2 concentration of 431.44 ppm at Mauna Loa Observatory, Hawaii in June 2026, up from 429.61 ppm in June 2025.",
      "verification_status": "verified"
    },
    {
      "id": "claim-4",
      "retrieved_date": "2026-09-07",
      "source_name": "NOAA",
      "source_url": "https://www.ncei.noaa.gov/news/global-climate-202607",
      "text": "NOAA's National Centers for Environmental Information reported that global surface temperatures in July 2026 were 2.12°F (1.18°C) above the 20th-century average, tying with 2024 for the warmest July on record, and that the January-July global surface temperature was the third highest on record. NCEI's annual outlook states it is very likely that 2026 will rank among the five-warmest years on record, with the highest probabilities favoring it as the third- or fourth-warmest.",
      "verification_status": "verified"
    }
  ],
  "description": "Sustained warming of Earth's climate system driven by human greenhouse-gas emissions, with widespread impacts on weather extremes, sea level, ecosystems, and human systems. Unlike discrete events, it is an ongoing, intensifying process: 2025 was the third-warmest year on NOAA's global record, 1.34°C above the 1850-1900 pre-industrial average, and the ten warmest years on record have all occurred since 2015. The pace has not slackened in 2026 — July 2026 tied 2024 as the warmest July on record, the January-July global temperature was the third highest on record, and NOAA's annual outlook makes it very likely that 2026 finishes among the five warmest years. Atmospheric CO2 at NOAA's Mauna Loa Observatory reached 431.44 ppm in June 2026, up from 429.61 ppm a year earlier and the highest level in over two million years.",
  "id": "global-warming",
  "last_updated": "2026-09-07T10:09:18Z",
  "name": "Climate Change (Global Warming)",
  "provenance": {
    "history": [
      {
        "at": "2026-09-07T10:09:18Z",
        "layer": "verify",
        "run_id": "2026-09-07T10-09-18Z-6b7e6a"
      }
    ],
    "last_layer": "verify",
    "last_run_id": "2026-09-07T10-09-18Z-6b7e6a"
  },
  "schema_version": "1.0",
  "sort_keys": {
    "composite": 35.0,
    "probability_rank": 5,
    "severity_rank": 3
  },
  "verification": {
    "confidence": "high",
    "notes": "gate: 4 verified, 0 disputed, 0 unverified -> verified",
    "status": "verified"
  }
}
