{
  "assessment": {
    "probability": {
      "estimate": "high",
      "numeric_annual": null,
      "window": "ongoing"
    },
    "severity": "continental",
    "summary": "A present, quantified decline in the productive capacity of land — 1.56 billion hectares degraded worldwide, including more than 460 million hectares of forest, and roughly 100 million hectares of healthy land lost each year — that is directly cutting crop yields for 1.7 billion people and is slow to reverse. Restoration lags badly behind the damage, and FAO prices the failure to restore at $878 billion to $6.3 trillion a year, 2 to 8.3 percent of global GDP.",
    "timeframe": "Ongoing and accumulating; FAO's SDG indicator 15.3.1 series shows degradation still expanding through 2019, with sub-Saharan Africa, Western Asia, Latin America and the Caribbean, and Southern Asia degrading 6 to 8 percent faster than the global average since 2015, while restoration remains far short of the 2030 targets."
  },
  "category": "resource",
  "claims": [
    {
      "id": "claim-1",
      "retrieved_date": "2026-10-12",
      "source_name": "FAO",
      "source_url": "https://www.fao.org/land-water/land/overview/en",
      "text": "FAO estimates that 1 660 million hectares of land — more than 10 percent of the world's land area — have been degraded by human activity, with over 60 percent of that degradation occurring on agricultural land, including cropland and pastureland.",
      "verification_status": "verified"
    },
    {
      "id": "claim-2",
      "retrieved_date": "2026-10-12",
      "source_name": "FAO",
      "source_url": "https://www.fao.org/sustainable-development-goals-data-portal/data/indicators/1531-proportion-of-land-that-is-degraded-over-total-land-area/en",
      "text": "Between 2015 and 2019 the world lost at least 100 million hectares of healthy and productive land every year, and these worsening trends impact the lives of 1.3 billion people who are estimated to be directly exposed to land degradation (SDG indicator 15.3.1).",
      "verification_status": "verified"
    },
    {
      "id": "claim-3",
      "retrieved_date": "2026-10-12",
      "source_name": "FAO",
      "source_url": "https://www.fao.org/sustainable-development-goals-data-portal/data/indicators/1531-proportion-of-land-that-is-degraded-over-total-land-area/en",
      "text": "In Eastern Asia, Latin America and the Caribbean, and Central Asia at least 20 percent of total land area was degraded over 2000-2019, while most other regions were over 10 percent; land in sub-Saharan Africa, Western Asia, Latin America and the Caribbean, and Southern Asia is degrading considerably faster than the global average, with increases of 6 percent to 8 percent since 2015.",
      "verification_status": "verified"
    },
    {
      "id": "claim-4",
      "retrieved_date": "2026-10-12",
      "source_name": "FAO",
      "source_url": "https://www.fao.org/agrifood-economics/news/detail-events/en/c/1754733/",
      "text": "1.7 billion people live in areas where crop yields have fallen by at least 10 percent due to human-induced land degradation (The State of Food and Agriculture 2025: Addressing land degradation across landholding scales, released 3 November 2025).",
      "verification_status": "verified"
    },
    {
      "id": "claim-5",
      "retrieved_date": "2026-10-12",
      "source_name": "FAO",
      "source_url": "https://www.fao.org/newsroom/detail/fao-report--restoring-forests-and-landscapes-is-critical-to-meeting-global-food-security-and-development-goals/en",
      "text": "FAO's State of the World's Forests 2026, released on 28 September 2026, finds that 1.56 billion hectares of land are degraded globally, and that more than 460 million hectares of forest are degraded worldwide.",
      "verification_status": "verified"
    },
    {
      "id": "claim-6",
      "retrieved_date": "2026-10-12",
      "source_name": "FAO",
      "source_url": "https://www.fao.org/newsroom/detail/fao-report--restoring-forests-and-landscapes-is-critical-to-meeting-global-food-security-and-development-goals/en",
      "text": "91 countries and areas have pledged more than 190 million hectares for forest restoration, but only 206.5 million hectares of forests are currently under restoration (FAO, The State of the World's Forests 2026).",
      "verification_status": "verified"
    },
    {
      "id": "claim-7",
      "retrieved_date": "2026-10-12",
      "source_name": "FAO",
      "source_url": "https://www.fao.org/newsroom/detail/fao-report--restoring-forests-and-landscapes-is-critical-to-meeting-global-food-security-and-development-goals/en",
      "text": "FAO puts the annual cost of failing to restore degraded ecosystems at $878 billion to $6.3 trillion, equivalent to 2 to 8.3 percent of annual GDP, while restoring more than 1 billion hectares of degraded land could generate $1.8 trillion per year in benefits (The State of the World's Forests 2026).",
      "verification_status": "verified"
    }
  ],
  "description": "Land degradation and desertification are the progressive loss of soil productivity and vegetation cover across the world's croplands, pastures, and drylands. FAO's State of the World's Forests 2026 puts degraded land at 1.56 billion hectares globally, including more than 460 million hectares of forest, and over 60 percent of human-induced degradation falls on agricultural land. Between 2015 and 2019 the world lost at least 100 million hectares of healthy, productive land a year, leaving 1.3 billion people directly exposed; 1.7 billion live where crop yields have fallen by at least 10 percent because of it. Restoration is not keeping pace: against pledges of more than 190 million hectares from 91 countries and areas, FAO counts only 206.5 million hectares of forest under restoration, and prices the failure to restore degraded ecosystems at $878 billion to $6.3 trillion a year. Because soil recovers over decades rather than seasons, losses compound rather than reverse.",
  "id": "land-degradation-desertification",
  "last_updated": "2026-10-12T10:21:01Z",
  "name": "Land Degradation and Desertification",
  "provenance": {
    "history": [
      {
        "at": "2026-10-12T10:21:01Z",
        "layer": "verify",
        "run_id": "2026-10-12T10-21-01Z-fb724f"
      }
    ],
    "last_layer": "verify",
    "last_run_id": "2026-10-12T10-21-01Z-fb724f"
  },
  "schema_version": "1.0",
  "sort_keys": {
    "composite": 24.0,
    "probability_rank": 4,
    "severity_rank": 2
  },
  "verification": {
    "confidence": "high",
    "notes": "gate: 7 verified, 0 disputed, 0 unverified -> verified",
    "status": "verified"
  }
}
