{
  "assessment": {
    "probability": {
      "estimate": "medium",
      "numeric_annual": null,
      "window": "ongoing"
    },
    "severity": "continental",
    "summary": "A steadily growing, already-tracked debris population in Earth orbit carries a real and rising risk of a self-sustaining collision cascade severe enough to disable critical satellite infrastructure.",
    "timeframe": "Debris accumulation is continuous and tracked in real time; a runaway cascade has no predicted date but becomes more likely as orbital object density rises."
  },
  "category": "technological",
  "claims": [
    {
      "id": "claim-1",
      "retrieved_date": "2026-09-14",
      "source_name": "NASA",
      "source_url": "https://orbitaldebris.jsc.nasa.gov/faq/",
      "text": "NASA's Orbital Debris Program Office states more than 25,000 tracked objects larger than 10 cm orbit Earth, with an estimated 500,000 objects between 1 and 10 cm, and more than 100 million objects larger than 1 mm; as of January 2022 the total mass of orbiting material exceeded 9,000 metric tons.",
      "verification_status": "verified"
    },
    {
      "id": "claim-2",
      "retrieved_date": "2026-09-14",
      "source_name": "NASA",
      "source_url": "https://orbitaldebris.jsc.nasa.gov/faq/",
      "text": "NASA states the International Space Station maneuvers to avoid a tracked object when the estimated collision probability exceeds 1 in 10,000, which occurs about once a year on average.",
      "verification_status": "verified"
    },
    {
      "id": "claim-3",
      "retrieved_date": "2026-09-14",
      "source_name": "NASA",
      "source_url": "https://www.earthdata.nasa.gov/news/feature-articles/rubble-trouble",
      "text": "NASA describes the Kessler syndrome as a domino effect that can result when objects in intersecting orbits collide at thousands of miles per hour, generating debris that raises the odds of further collisions.",
      "verification_status": "verified"
    },
    {
      "id": "claim-4",
      "retrieved_date": "2026-09-14",
      "source_name": "NASA",
      "source_url": "https://orbitaldebris.jsc.nasa.gov/quarterly-news/pdfs/ODQNv30i1.pdf",
      "text": "The Satellite Box Score in NASA's Orbital Debris Quarterly News (Volume 30, Issue 1 & 2, July 2026) lists 33,098 objects in Earth orbit cataloged by the U.S. Space Surveillance Network as of 4 May 2026 — 18,189 spacecraft, active and defunct, and 14,909 spent rocket bodies and other cataloged debris.",
      "verification_status": "verified"
    },
    {
      "id": "claim-5",
      "retrieved_date": "2026-09-14",
      "source_name": "NASA",
      "source_url": "https://orbitaldebris.jsc.nasa.gov/quarterly-news/pdfs/ODQNv30i1.pdf",
      "text": "NASA's Orbital Debris Program Office states that because the orbital debris population follows a power-law size distribution, there is far more millimeter-sized debris (on the order of 100 million) than large, trackable objects (approximately 50,000), so the likelihood of non-catastrophic but mission-ending damage from millimeter-sized debris is orders of magnitude greater than that of an accidental collision with a large, trackable object.",
      "verification_status": "verified"
    }
  ],
  "description": "Decades of launches, spent rocket stages, defunct satellites, and past collisions have left a large and growing population of debris in Earth orbit. As the density of objects in low Earth orbit rises, so does the risk of a cascading chain reaction of collisions — the 'Kessler syndrome' — that could render whole orbital bands too hazardous for satellites and crewed spacecraft for generations, threatening the GPS, communications, weather, and scientific infrastructure the world now depends on. The US Space Surveillance Network now catalogs more than 33,000 objects in orbit, over half of them spacecraft, and NASA estimates on the order of 100 million fragments larger than a millimetre that are too small to track yet still capable of ending a mission. Spacecraft including the International Space Station maneuver away from tracked objects when the collision probability exceeds 1 in 10,000.",
  "id": "space-debris-kessler-syndrome",
  "last_updated": "2026-09-14T10:10:11Z",
  "name": "Space Debris and Kessler Syndrome",
  "provenance": {
    "history": [
      {
        "at": "2026-09-14T10:10:11Z",
        "layer": "verify",
        "run_id": "2026-09-14T10-10-11Z-b780c9"
      }
    ],
    "last_layer": "verify",
    "last_run_id": "2026-09-14T10-10-11Z-b780c9"
  },
  "schema_version": "1.0",
  "sort_keys": {
    "composite": 23.0,
    "probability_rank": 3,
    "severity_rank": 2
  },
  "verification": {
    "confidence": "high",
    "notes": "gate: 5 verified, 0 disputed, 0 unverified -> verified",
    "status": "verified"
  }
}
