{
  "assessment": {
    "probability": {
      "estimate": "high",
      "numeric_annual": null,
      "window": "ongoing"
    },
    "severity": "continental",
    "summary": "Autonomous weapons are being fielded faster than the law governing them is being written; large General Assembly majorities back new rules, but several states with the most capable systems vote against them. The expert group has closed with a consensus set of agreed elements for an instrument, leaving the November 2026 Review Conference to decide whether negotiations ever start — and an arms race under no binding constraint as the default if they do not.",
    "timeframe": "Ongoing, with a decision point in view: the seventh Review Conference of the Convention on Certain Conventional Weapons meets at the Palais des Nations in Geneva on 16-20 November 2026, and is where States decide whether to launch negotiations on a legally binding instrument, against a UN and ICRC target of adopting one by the end of 2026."
  },
  "category": "technological",
  "claims": [
    {
      "id": "claim-1",
      "retrieved_date": "2026-10-26",
      "source_name": "United Nations",
      "source_url": "https://news.un.org/en/story/2026/08/1168196",
      "text": "In a renewed joint appeal on 25 August 2026, UN Secretary-General António Guterres said: \"We are now dangerously close to crossing a moral red line: the autonomous targeting of humans by machines.\" The appeal renews a 2023 joint call for States to negotiate a legally binding agreement by 2026 and points to the seventh Review Conference of the Convention on Certain Conventional Weapons, in Geneva in November 2026, as the clearest path available.",
      "verification_status": "verified"
    },
    {
      "id": "claim-2",
      "retrieved_date": "2026-08-31",
      "source_name": "United Nations",
      "source_url": "https://press.un.org/en/2025/ga12736.doc.htm",
      "text": "On 1 December 2025 the General Assembly adopted its resolution on lethal autonomous weapons systems (A/C.1/80/L.41) by a recorded vote of 164 in favour to 6 against (Belarus, Burundi, Democratic People's Republic of Korea, Israel, Russian Federation, United States), with 7 abstentions.",
      "verification_status": "verified"
    },
    {
      "id": "claim-3",
      "retrieved_date": "2026-08-31",
      "source_name": "United Nations",
      "source_url": "https://press.un.org/en/2024/ga12660.doc.htm",
      "text": "On 2 December 2024 the General Assembly adopted its resolution on lethal autonomous weapons systems (A/C.1/79/L.77) by a recorded vote of 166 in favour to 3 against (Belarus, Democratic People's Republic of Korea, Russian Federation), with 15 abstentions, expressing concern about the risk of an emerging arms race, exacerbation of existing conflicts, humanitarian crises and miscalculations, lowering the threshold for an escalation of conflicts and proliferation, including to unauthorized recipients such as non-State actors.",
      "verification_status": "verified"
    },
    {
      "id": "claim-4",
      "retrieved_date": "2026-10-26",
      "source_name": "United Nations",
      "source_url": "https://news.un.org/en/story/2025/05/1163256",
      "text": "On 14 May 2025 the UN Secretary-General called lethal autonomous weapon systems \"politically unacceptable\" and \"morally repugnant\", said that machines with the power and discretion to take human lives without human control should be prohibited by international law, and urged Member States to agree clear regulations and prohibitions by 2026.",
      "verification_status": "verified"
    },
    {
      "id": "claim-5",
      "retrieved_date": "2026-10-26",
      "source_name": "United Nations",
      "source_url": "https://transcripts.un.org/en/ga/c1/81/2",
      "text": "At the First Committee's second plenary meeting of the General Assembly's eighty-first session, on 6 October 2026, the Chair said the Group of Governmental Experts on lethal autonomous weapon systems, under the framework of the Convention on Certain Conventional Weapons, \"concluded its work with a consensus report\"; the High Representative for Disarmament Affairs, Izumi Nakamitsu, cited the agreed elements for an instrument on lethal autonomous weapons systems as an achievement showing that the disarmament machinery can adapt to new challenges.",
      "verification_status": "verified"
    },
    {
      "id": "claim-6",
      "retrieved_date": "2026-10-26",
      "source_name": "United Nations",
      "source_url": "https://indico.un.org/event/1019366/",
      "text": "The 7th Review Conference of the High Contracting Parties to the Convention on Certain Conventional Weapons is scheduled to run from 16 to 20 November 2026 at the Palais des Nations in Geneva, Switzerland.",
      "verification_status": "verified"
    }
  ],
  "description": "Lethal autonomous weapons systems select and engage targets without meaningful human control over the decision to kill. No binding international instrument governs them. The General Assembly has adopted successive resolutions on the subject — 166 to 3 in December 2024, 164 to 6 in December 2025 — but several of the states with the most advanced programmes vote against. The expert group under the Convention on Certain Conventional Weapons has closed its three-year mandate with a consensus report setting out agreed elements for an instrument it was never mandated to negotiate; whether negotiations open now falls to the Convention's seventh Review Conference, in Geneva on 16-20 November 2026. The Secretary-General and the President of the International Committee of the Red Cross jointly call that conference the clearest path available, warning in August 2026 that the world is dangerously close to crossing a moral red line in the autonomous targeting of humans by machines. The risk is less a single catastrophe than an arms race under no binding constraint that lowers the threshold for using force, compresses escalation below human reaction times, and proliferates to non-State actors.",
  "id": "lethal-autonomous-weapons",
  "last_updated": "2026-10-26T10:22:25Z",
  "name": "Lethal Autonomous Weapons Systems",
  "provenance": {
    "history": [
      {
        "at": "2026-10-26T10:22:25Z",
        "layer": "verify",
        "run_id": "2026-10-26T10-22-25Z-a46ecf"
      }
    ],
    "last_layer": "verify",
    "last_run_id": "2026-10-26T10-22-25Z-a46ecf"
  },
  "schema_version": "1.0",
  "sort_keys": {
    "composite": 24.0,
    "probability_rank": 4,
    "severity_rank": 2
  },
  "verification": {
    "confidence": "high",
    "notes": "gate: 6 verified, 0 disputed, 0 unverified -> verified",
    "status": "verified"
  }
}
